Device Descriptor:
  bLength                       18
  bDescriptorType               1
  bcdUSB                        2.0
  bDeviceClass                  0
  bDeviceSubClass               0
  bDeviceProtocol               0
  bMaxPacketSize0               64
  idVendor                      0x0204
  idProduct                     0x6025
  bcdDevice                     1.0
  iManufacturer                 1
  iProduct                      2       Flash Disk
  iSerial                       3       160921004A02F510
  bNumConfigurations            1

  Configuration Descriptor:
    bLength                     9
    bDescriptorType             2
    wTotalLength                32
    bNumInterfaces              1
    bConfigurationvalue         1
    iConfiguration              0       {no data}
    bmAttributes                128
    bMaxPower                   50

    Interface Descriptor:
      bLength                   9
      bDescriptorType           4
      bInterfaceNumber          0
      bAlternateSetting         0
      bNumEndpoints             2
      bInterfaceClass           8       Storage
      bInterfaceSubClass        6       SCSI command set
      bInterfaceProtocol        80      BBB
      iInterface                0       {no data}

    Endpoint Descriptor:
      bLength                   7
      bDescriptorType           5
      bEndpointAddress          1       OUT
      bmAttributes              2       Bulk
      wMaxPacketSize            64
      bInterval                 0

    Endpoint Descriptor:
      bLength                   7
      bDescriptorType           5
      bEndpointAddress          1       IN
      bmAttributes              2       Bulk
      wMaxPacketSize            64
      bInterval                 0